{
  "schema_version": "viewpoint-card-v1",
  "card_id": "VIEWCARD_usovsxle20260714",
  "revision": 1,
  "state": "conditional",
  "lineage": {
    "input_artifact_refs": [
      "VIEWINTENT_usovsxle20260714",
      "POST_uso_vs_xle_20260714",
      "LOGICCARD_usovsxle20260714",
      "CHART_usovsxle20260714",
      "INDPACK_usovsxle20260714",
      "SETTLE_usovsxle20260714"
    ],
    "creator_intent_ref": "VIEWINTENT_usovsxle20260714",
    "thesis_ref": null,
    "post_ref": "POST_uso_vs_xle_20260714",
    "logic_card_ref": "LOGICCARD_usovsxle20260714",
    "chart_ref": "CHART_usovsxle20260714",
    "indicator_pack_ref": "INDPACK_usovsxle20260714",
    "settlement_claim_ref": "SETTLE_usovsxle20260714"
  },
  "creator": {
    "creator_ref": "creator:vito",
    "display_name": "Vito",
    "handle": null,
    "author_type": "hybrid",
    "decision_owner": "creator"
  },
  "header": {
    "instrument_id": "USO:ARCX",
    "ticker": "USO",
    "direction": "outperform",
    "direction_label": "Outperform XLE",
    "benchmark_instrument_id": "XLE:ARCX",
    "benchmark_ticker": "XLE",
    "deadline_at": "2026-07-14T20:00:00Z",
    "deadline_label": "July 14 close",
    "status_label": "Needs confirmation"
  },
  "thesis": {
    "headline": "After the tanker attack, USO will absorb the risk premium before XLE",
    "body": "The attack is confirmed; expansion of the insurance zone still awaits an authoritative notice. The view compares one-day relative returns on a synchronized baseline.",
    "creator_text": "On reaction speed alone, I choose USO. Expansion of the insurance zone remains an unverified condition.",
    "creator_text_preserved": true,
    "content_ref": "POST_uso_vs_xle_20260714"
  },
  "blocks": [
    {
      "id": "B1",
      "order": 1,
      "kind": "creator_text",
      "role": "context",
      "state": "ready",
      "title": "One more thought",
      "summary": "On reaction speed alone, I choose USO. Expansion of the insurance zone remains an unverified condition.",
      "artifact_ref": "VIEWINTENT_usovsxle20260714",
      "fact_refs": [],
      "source_refs": [],
      "display_variant": "plain_text"
    },
    {
      "id": "B2",
      "order": 2,
      "kind": "news",
      "role": "supports",
      "state": "ready",
      "title": "Tanker attack",
      "summary": "UKMTO received a report that a tanker was struck by a missile.",
      "artifact_ref": "research-pack-v1:uso-tanker",
      "fact_refs": [
        "F1"
      ],
      "source_refs": [
        "https://example.com/news"
      ],
      "display_variant": "source_card"
    },
    {
      "id": "B3",
      "order": 3,
      "kind": "logic_card",
      "role": "supports",
      "state": "conditional",
      "title": "How an event becomes a trading view",
      "summary": "The event travels through shipping, crude futures, and capital flows into a lead-lag repricing of AAA versus BBB.",
      "artifact_ref": "LOGICCARD_usovsxle20260714",
      "fact_refs": [
        "F1",
        "F2"
      ],
      "source_refs": [
        "https://example.com/news"
      ],
      "display_variant": "logic_card"
    },
    {
      "id": "B4",
      "order": 4,
      "kind": "chart",
      "role": "supports",
      "state": "conditional",
      "title": "USO relative to XLE",
      "summary": "The current reading is still forming and is for observation only.",
      "artifact_ref": "CHART_usovsxle20260714",
      "fact_refs": [
        "I2"
      ],
      "source_refs": [
        "cuebook:market.candles"
      ],
      "display_variant": "thesis_chart"
    },
    {
      "id": "B5",
      "order": 5,
      "kind": "indicator",
      "role": "supports",
      "state": "conditional",
      "title": "Relative strength",
      "summary": "The forming excess return is positive.",
      "artifact_ref": "INDPACK_usovsxle20260714",
      "fact_refs": [
        "I2"
      ],
      "source_refs": [
        "cuebook:market.candles"
      ],
      "display_variant": "indicator_strip"
    },
    {
      "id": "B6",
      "order": 6,
      "kind": "settlement",
      "role": "settles",
      "state": "conditional",
      "title": "How it settles",
      "summary": "Compare total returns from the synchronized baseline at expiry.",
      "artifact_ref": "SETTLE_usovsxle20260714",
      "fact_refs": [],
      "source_refs": [
        "market-data:official-close"
      ],
      "display_variant": "settlement_footer"
    }
  ],
  "settlement": {
    "settleable": true,
    "claim_ref": "SETTLE_usovsxle20260714",
    "one_line": "USO outperforms | relative to XLE | needs confirmation",
    "state": "needs_confirmation"
  },
  "disclosures": {
    "position_status": "unknown",
    "commercial_status": "unknown",
    "identity_status": "unknown",
    "ai_assistance_status": "disclosed",
    "public_lines": [
      "AI assisted with research and structure."
    ]
  },
  "quality_report": {
    "decision": "conditional",
    "warnings": [
      "Chart and indicator use forming daily bars."
    ],
    "hard_failures": []
  }
}
